ID,,cardName,level,rarity,category,description,,,,,,physicDamage,magicDamage,fireDamage,lightingDamage,poisonDamage,bleedDamage,physicResistancePorcentage,magicResistancePorcentage,fireResistancePorcentage,lightingResistancePorcentage,poisonResistancePorcentage,bleedResistancePorcentage,physicDamageBonus,magicDamageBonus,fireDamageBonus,lightingDamageBonus,poisonDamageBonus,bleedDamageBonus,hitAmount,attackPrecisionModifier,blockAmount,dodgeChance,criticalChance,criticalMultiplier,healthPointBoost,availableCards,availableLevels,upgradeIntFunction,upgradeIntFunctionValue,upgradeFloatFunctionValue,upgradeFloatFunction
CA22,,Crusader,1,Common,Helmet,May this helmet fend off the mighty dances of those you dare face...,Helmet 01 Knight Black,-,-,,,42,0,0,0,0,0,13.00%,0.00%,0.00%,0.00%,10.00%,0.00%,0.00%,0.00%,0.00%,0.00%,5.00%,0.00%,1,Normal,0.00,0.00,5,2,25,1,5,Exponential,2,1.1,Exponential
CA34,,Feather Axe,1,Common,Weapon,"It flew like a feather and as an axe slew. Like music, it awoke my body, my soul, my brain.",Axe 02 Green,-,-,,,31,20,0,0,0,0,0.00%,0.00%,0.00%,0.00%,0.00%,0.00%,0.00%,0.00%,0.00%,0.00%,0.00%,0.00%,1,Normal,0.00,0.00,5,2,100,1,5,Linear,1.27,1.1,Exponential
CA52,,Ghost,1,Common,Pet,"Sometimes standing still, wallowing in the water, can be a much wiser move than going forward.",-,-,-,,,0,21,0,21,0,0,0.00%,0.00%,0.00%,5.00%,0.00%,0.00%,0.00%,0.00%,0.00%,0.00%,0.00%,0.00%,1,Normal,0.00,0.00,4,2,100,1,5,Exponential,1.57,1.1,Exponential
CA32,,Emerald Ring,1,Epic,Magic,You may spend your life seeking the emerald ring... and it would be a life well spent.,-,-,-,,,160,0,0,0,0,0,10.00%,0.00%,0.00%,0.00%,0.00%,0.00%,0.00%,0.00%,0.00%,0.00%,0.00%,0.00%,1,Easy,0.00,0.00,5,2,100,1,5,Exponential,1.42,1.1,Exponential
CA56,,Love Pendant,1,Common,Magic,"Love is fickle, shifting, urgent. But it is only painful if something within you is in pain.",-,-,-,,,46,0,0,0,0,0,0.00%,0.00%,0.00%,0.00%,0.00%,0.00%,0.00%,0.00%,0.00%,0.00%,0.00%,0.00%,1,Easy,0.00,0.00,5,2,50,1,5,Linear,2.27,1.1,Exponential
CA2,,Ambar Pendant,1,Rare,Magic,This powerful pendant has brought balance and harmony to the lawless Nomads for centuries.,-,-,-,,,72,0,0,0,0,0,0.00%,0.00%,0.00%,0.00%,0.00%,0.00%,0.00%,10.00%,0.00%,5.00%,0.00%,0.00%,1,Normal,0.00,0.00,0,2,0,1,5,Linear,1.48,1.1,Exponential
CA3,,Ancient Shield,1,Common,Shield,This ancient shield cointains the power of all the warriors who've used it.,Shield 03 Green,-,-,,,43,0,0,0,0,0,0.00%,0.00%,0.00%,0.00%,0.00%,10.00%,0.00%,0.00%,0.00%,0.00%,0.00%,0.00%,1,Normal,0.80,0.01,5,2,0,1,5,Linear,1.47,1.1,Exponential
CA4,,Argentum Sword,1,Unique,Weapon,,,,,,,100,100,0,0,0,0,0.00%,0.00%,0.00%,0.00%,0.00%,0.00%,0.00%,2.00%,0.00%,0.00%,0.00%,0.00%,1,Normal,0.00,0.00,7,2,0,1,5,Linear,1.8,1.1,Exponential
CA8,,Black Crow,1,Rare,Pet,Befriend the creatures of death. They know it best.,-,-,-,,,73,0,0,0,0,0,0.00%,0.00%,0.00%,0.00%,0.00%,0.00%,0.00%,0.00%,0.00%,0.00%,0.00%,5.00%,1,Normal,0.00,0.00,4,2,0,1,5,Linear,1.28,1.1,Exponential
CA37,,Boar,1,Rare,Pet,Fickle fox finds frail freedom for his friends to keep safe. Will you fight or will you flake?,-,-,-,,,79,0,0,0,0,50,0.00%,0.00%,5.00%,0.00%,0.00%,0.00%,0.00%,0.00%,0.00%,0.00%,0.00%,0.00%,1,Normal,0.00,0.00,4,2,0,1,5,Exponential,1.28,1.1,Exponential
CA14,,Bounty Hunter Cloak,1,Common,Armor,"They say gold is only glitz, but gold is concrete. It's tangible. I say glory is glitz— only gold matters.",-,Male Brown Archer 03 Red,Female Brown Archer 03 Red,,,64,0,0,0,0,0,20.00%,0.00%,0.00%,0.00%,0.00%,0.00%,0.00%,0.00%,0.00%,0.00%,0.00%,10.00%,1,Normal,0.00,0.02,2,2,0,1,5,Linear,1.18,1.1,Exponential
CA17,,Chainmail,1,Common,Armor,"They told me to trust God, but I couldn't find him. So I trusted my chainmail instead.",-,Male Brown Knight 02 White,Female Brown Knight 02 White,,,48,0,0,0,0,0,16.00%,0.00%,0.00%,0.00%,0.00%,0.00%,0.00%,0.00%,0.00%,0.00%,10.00%,0.00%,1,Normal,0.00,0.05,2,2,0,1,5,Linear,1.37,1.1,Exponential
CA21,,Crossbow,1,Common,Weapon,...but the crossbow taught me that distance can too be an ally in the deadly dance of life.,Crossbow 01 Black,-,-,,,51,0,0,0,0,0,0.00%,0.00%,0.00%,0.00%,0.00%,0.00%,0.00%,0.00%,0.00%,0.00%,0.00%,0.00%,2,Normal,0.00,0.03,3,2.5,0,1,5,Linear,1.67,1.1,Exponential
CA26,,Demon Face,1,Epic,Helmet,"True demons are never within. True demons are those who take you over, who make be someone else.",Mask 03 Yellow,-,-,,,180,0,0,0,0,0,20.00%,10.00%,10.00%,10.00%,10.00%,10.00%,0.00%,0.00%,0.00%,0.00%,0.00%,0.00%,1,Normal,0.00,0.03,2,2,0,1,5,Exponential,1.44,1.1,Exponential
CA28,,Desert Shield,1,Common,Shield,"The sand forged a shield that compressed its very soul, a shield could be the vast desert.",Shield 04 Yellow,-,-,,,45,0,0,0,0,0,0.00%,0.00%,0.00%,0.00%,10.00%,0.00%,0.00%,0.00%,0.00%,0.00%,0.00%,0.00%,1,Normal,0.80,0.00,5,2,0,1,5,Linear,1.67,1.1,Exponential
CA29,,Dragon Helmet,1,Epic,Helmet,"Fancy yourself strong as the mighty dragon, evasive as fire...",Helmet 08 Red,-,-,,,169,0,0,0,0,0,20.00%,0.00%,40.00%,0.00%,0.00%,0.00%,0.00%,0.00%,0.00%,0.00%,0.00%,0.00%,1,Normal,0.00,0.03,2,2,0,1,5,Exponential,1.45,1.1,Exponential
CA71,,Glory Shield,1,Rare,Shield,"They say glory is a sad word and I agree... Like sadness, glory requires every fiber of your soul.",Shield 07 Yellow,-,-,,,65,0,0,10,0,0,0.00%,0.00%,0.00%,10.00%,0.00%,0.00%,0.00%,0.00%,0.00%,2.00%,0.00%,0.00%,1,Normal,0.85,0.00,5,2,0,1,5,Exponential,1.38,1.1,Exponential
CA42,,Golden Plate,1,Legendary,Armor,Iron withstands the stroke of the sword. Gold resists the merciless lightning.,-,Male Brown Knight 06 Yellow,Female Brown knight 06 Yellow,,,62,0,0,0,0,0,24.00%,0.00%,0.00%,10.00%,0.00%,0.00%,0.00%,0.00%,0.00%,0.00%,0.00%,0.00%,1,Normal,0.00,0.03,2,2,0,1,5,Linear,1.08,1.1,Exponential
CA43,,Golden Ring,1,Rare,Magic,But I never truly felt the Rhythm Queen without my golden ring...,-,-,-,,,0,0,0,70,0,0,0.00%,0.00%,0.00%,0.00%,0.00%,0.00%,0.00%,0.00%,0.00%,10.00%,0.00%,0.00%,1,Normal,0.00,0.00,5,2,0,1,5,Linear,1.28,1.1,Exponential
CA48,,Horned Helmet,1,Common,Helmet,Stakes are higher in a battle when your demons are involved.,Helmet 03 Black,-,-,,,46,0,0,0,0,0,11.00%,0.00%,0.00%,0.00%,0.00%,0.00%,0.00%,0.00%,0.00%,0.00%,0.00%,0.00%,1,Normal,0.00,0.03,2,2,0,1,5,Linear,1.37,1.1,Exponential
CA54,,Lightning Knuckles,1,Rare,Weapon,Let your hands be as fast as a lightning; only then you can say you dance.,Knuckles 02 Brown,-,-,,,45,0,0,30,0,0,0.00%,0.00%,0.00%,0.00%,0.00%,0.00%,0.00%,0.00%,0.00%,2.00%,0.00%,0.00%,1,Normal,0.00,0.04,10,2,0,1,5,Linear,1.18,1.1,Exponential
CA59,,Mithril Waraxe,1,Epic,Weapon,"They forged an axe of mithril, and its unfaltering beauty seemed meaningless next to its eternal strength.",Hammer 03 Magenta,-,-,,,280,0,0,0,0,0,0.00%,0.00%,0.00%,0.00%,0.00%,0.00%,4.00%,0.00%,0.00%,0.00%,0.00%,0.00%,1,Normal,0.00,0.00,3,2.5,0,1,5,Exponential,1.31,1.1,Exponential
CA63,,Pumpkin Helmet,1,Seasonal,Helmet,"All looks jolly as Christmas draws closer, but worry not my dear! Evil's just around the corner.",Helmet 04 Pumpkin,-,-,,,57,0,0,0,0,0,20.00%,0.00%,0.00%,0.00%,0.00%,30.00%,0.00%,0.00%,0.00%,0.00%,0.00%,0.00%,1,Normal,0.00,0.00,5,2,0,1,5,Linear,2.48,1.1,Exponential
CA67,,Royal Cloak,1,Legendary,Armor,"Royalty is not something I was born with, but a cloak I learnt to wear.",-,Male Brown Knight 04 Black,Female Brown Knight 04 Black,,,40,0,0,0,0,0,26.00%,0.00%,0.00%,20.00%,0.00%,0.00%,0.00%,0.00%,0.00%,0.00%,0.00%,0.00%,1,Normal,0.00,0.00,2,2,0,1,5,Linear,1.67,1.1,Exponential
CA75,,Scythe,1,Common,Weapon,The scythe first reaped harvests... now it reaps victories.,Scyte 02 White,-,-,,,38,0,0,0,0,30,0.00%,0.00%,0.00%,0.00%,0.00%,0.00%,0.00%,0.00%,0.00%,0.00%,0.00%,0.00%,1,Normal,0.00,0.02,20,3,0,1,5,Linear,1.67,1.1,Exponential
CA76,,Short Sword,1,Common,Weapon,A brave arm makes a short sword long.,Sword 01 White,-,-,,,55,0,0,0,0,0,0.00%,0.00%,0.00%,0.00%,0.00%,0.00%,0.00%,0.00%,0.00%,0.00%,0.00%,0.00%,1,Normal,0.00,0.00,5,2,0,1,5,Linear,1.77,1.1,Exponential
CA77,,Silk Robes,1,Common,Armor,Let silk hold your body like a coccoon long enough for your wings to grow.,-,Make Brown King 01 Green,Female Brown King 01 Green,,,43,0,0,0,0,0,7.00%,7.00%,0.00%,0.00%,0.00%,0.00%,0.00%,0.00%,0.00%,0.00%,0.00%,0.00%,1,Normal,0.00,0.00,5,2,0,1,5,Linear,2.07,1.1,Exponential
CA82,,Spider,1,Common,Pet,Get a dog and you'll always have a friend on the road. That's why I prefer spiders.,-,-,-,,,37,0,0,0,15,0,0.00%,0.00%,0.00%,0.00%,0.00%,5.00%,0.00%,0.00%,0.00%,0.00%,0.00%,0.00%,1,Normal,0.00,0.00,4,2,0,1,5,Linear,1.37,1.1,Exponential
CA83,,Spider Ring,1,Epic,Magic,"Dark and cluttered like the nest where it lay, the spider ring will make you invincible... or eat you slowly inside.",-,-,-,,,101,0,0,0,20,0,10.00%,0.00%,0.00%,0.00%,10.00%,0.00%,0.00%,0.00%,0.00%,0.00%,0.00%,0.00%,1,Normal,0.00,0.00,0,2,0,1,5,Linear,1.55,1.1,Exponential
CA85,,Spike Tunic,1,Epic,Armor,The spike tunic kept Saladin safe from his greatest weakness: self doubt.,-,Male Brown Wizard 02 White,Female Brown Wizard 02 White,,,41,0,0,0,0,0,12.00%,0.00%,0.00%,0.00%,30.00%,0.00%,0.00%,0.00%,0.00%,0.00%,5.00%,0.00%,1,Normal,0.00,0.01,5,2,0,1,5,Linear,2.77,1.1,Exponential
CA87,,Strength Ring,1,Rare,Magic,"This ring used to be the belt of Fatso de Dwarf. And if it held its belly, it could hold anything.",-,-,-,,,0,0,70,0,0,0,0.00%,0.00%,0.00%,0.00%,0.00%,0.00%,10.00%,0.00%,5.00%,0.00%,0.00%,0.00%,1,Normal,0.00,0.00,5,2,0,1,5,Exponential,1.68,1.1,Exponential
CA89,,Swiped Chestplate,1,Common,Armor,Those who fear protect their heads... and those who dance protect their hearts.,-,Male Brown Barbarian 03 Black,Female brown Barbarian 03 Black,,,40,0,0,0,0,0,13.00%,0.00%,0.00%,0.00%,0.00%,0.00%,2.50%,0.00%,0.00%,0.00%,0.00%,0.00%,1,Normal,0.00,0.00,5,2,0,1,5,Linear,1.77,1.1,Exponential
CA1,,Aki Mask,1,Epic,Pet,"Choose Aki like you choose a friend: blindly, inexplicably. Sometimes a mask can be the truest of friends.",-,-,-,,,0,169,0,0,0,0,0.00%,5.00%,0.00%,0.00%,0.00%,0.00%,0.00%,0.00%,0.00%,0.00%,0.00%,0.00%,1,Hard,0.00,0.00,4,2,0,1,5,Exponential,1.45,1.1,Exponential
CA93,,Angel Helmet,1,Unique,Helmet,"Guardian angels are not in the sky, gladiator... they're in your head.",Helmet 05 White,-,-,,,135,0,0,16,0,0,20.00%,20.00%,0.00%,30.00%,0.00%,0.00%,0.00%,0.00%,0.00%,0.00%,0.00%,0.00%,1,Hard,0.00,0.00,5,2,0,1,5,Exponential,1.5,1.1,Exponential
CA7,,Bird Helmet,1,Epic,Helmet,Earth teaches us to dance. Sky teaches us to fly.,Helmet 10 Blue,-,-,,,0,135,0,0,0,0,26.00%,0.00%,0.00%,0.00%,0.00%,0.00%,0.00%,5.00%,0.00%,0.00%,0.00%,0.00%,1,Hard,0.00,0.01,0,2,0,1,5,Exponential,1.55,1.1,Exponential
CA9,,Black Leather,1,Rare,Armor,Assassins don't actually need protection. They need lightness to sway away from death.,-,Male Brown Archer 04 Black,Female Brown Archer 04 Black,,,33,0,0,0,0,75,15.00%,0.00%,0.00%,0.00%,0.00%,0.00%,0.00%,0.00%,0.00%,5.00%,0.00%,0.00%,1,Hard,0.00,0.00,5,2,0,1,5,Exponential,1.8,1.1,Exponential
CA11,,Black Sword,1,Rare,Weapon,No one knew shine could be black until this meteor-crafted sword blinded us with its darkness.,Sword 10 Black Gold,-,-,,,17,17,17,17,17,17,0.00%,0.00%,0.00%,0.00%,0.00%,0.00%,0.00%,0.00%,0.00%,0.00%,0.00%,0.00%,1,Hard,0.00,0.00,5,2,0,1,5,Linear,1.13,1.1,Exponential
CA12,,Blue Leather,1,Epic,Armor,"An armour made of the blue of the moon at its highest, when everything is silent, everything is possible...",-,Male Brown Knight 05 Blue,Female Brown Knight 05 Blue,,,131,0,0,0,0,0,0.00%,40.00%,0.00%,0.00%,0.00%,0.00%,0.00%,0.00%,0.00%,0.00%,0.00%,0.00%,1,Hard,0.00,0.00,5,2,0,1,5,Linear,1.45,1.1,Exponential
CA13,,Blue Scimitar,1,Rare,Weapon,"The blue scimitar called me, and its cold steel seemed to say: a true mage can also use the earthly blade.",Sword 03 Blue,-,-,,,44,30,0,0,0,0,0.00%,0.00%,0.00%,0.00%,0.00%,0.00%,0.00%,0.00%,0.00%,0.00%,0.00%,0.00%,1,Hard,0.00,0.00,5,2,0,1,5,Exponential,1.58,1.1,Exponential
CA16,,Captain Armor,1,Rare,Armor,"Ah, Captain, the stories this armor can't tell...",-,Male Brown Knight 03 Purple,Female Brown Knight 03 Purple,,,168,0,0,0,0,0,16.00%,40.00%,0.00%,0.00%,0.00%,0.00%,0.00%,10.00%,0.00%,0.00%,0.00%,0.00%,1,Hard,0.00,0.03,2,2,0,1,5,Exponential,1.45,1.1,Exponential
CA19,,Cleric Mace,1,Unique,Weapon,,Mace 01 Gold,-,-,,,150,0,0,80,0,0,0.00%,0.00%,0.00%,0.00%,0.00%,0.00%,0.00%,0.00%,0.00%,2.00%,0.00%,0.00%,1,Hard,0.00,0.00,5,2,0,1,5,Exponential,1.6,1.1,Exponential
CA27,,Demon Slayer,1,Epic,Weapon,"Slay like you're not yourself, like you are the dark music that runs through your veins.",Sword 02 Fire,-,-,,,135,0,105,0,0,0,0.00%,0.00%,0.00%,0.00%,0.00%,0.00%,0.00%,0.00%,0.00%,0.00%,0.00%,0.00%,1,Hard,0.00,0.00,5,2,0,1,5,Exponential,1.35,1.1,Exponential
CA46,,Dragon Shield,1,Legendary,Shield,Dragons spit fire because they hold life in every breath... and so does this shield.,Shield 10 Red,-,-,,,110,0,60,0,0,0,0.00%,0.00%,15.00%,0.00%,0.00%,0.00%,0.00%,0.00%,2.00%,0.00%,0.00%,0.00%,1,Hard,1.00,0.00,5,2,0,1,5,Exponential,1.47,1.1,Exponential
CA31,,El Yelmo,1,Common,Helmet,"El Yelmo, the Spanish called it, and the beauty of its name rang within me like an everlasting battle.",Helmet 07 Black,-,-,,,145,0,0,0,0,0,18.00%,0.00%,0.00%,0.00%,0.00%,20.00%,0.00%,0.00%,0.00%,0.00%,0.00%,0.00%,1,Hard,0.00,0.03,2,2,0,1,5,Linear,1.05,1.1,Exponential
CA33,,Falcon,1,Common,Pet,"Never underestimate the power of sight: once your target's been spotted, you have only a choice to make.",-,-,-,,,17,0,0,0,0,30,0.00%,0.00%,0.00%,0.00%,0.00%,0.00%,0.00%,0.00%,0.00%,5.00%,0.00%,0.00%,1,Hard,0.00,0.00,4,2,0,1,5,Linear,1.47,1.1,Exponential
CA36,,Flying Dragon,1,Legendary,Pet,"Fire is untouchable because it's forever shifting. It burns like urgency, like an untamed desire.",-,-,-,,,60,0,120,0,0,0,0.00%,0.00%,0.00%,0.00%,0.00%,0.00%,0.00%,0.00%,10.00%,0.00%,0.00%,0.00%,1,Hard,0.00,0.00,4,2,0,1,5,Exponential,1.42,1.1,Exponential
CA41,,Golden Falchion,1,Legendary,Weapon,It is only to a true warrior that the golden falchion reveals itself.,Sword 03 Gold,-,-,,,110,0,0,90,0,0,0.00%,0.00%,0.00%,0.00%,0.00%,0.00%,0.00%,0.00%,0.00%,2.00%,0.00%,0.00%,1,Hard,0.00,0.00,5,2,0,1,5,Exponential,1.44,1.1,Exponential
CA40,,Haunted Shield,1,Epic,Shield,"And the lives of those unfairly killed forever lived in this shield, ready for revenge..",Shield 05 Purple,-,-,,,179,0,0,0,0,0,0.00%,0.00%,0.00%,0.00%,0.00%,0.00%,0.00%,0.00%,0.00%,0.00%,0.00%,0.00%,1,Hard,0.80,0.00,5,4,0,1,5,Exponential,1.44,1.1,Exponential
CA47,,Hood,1,Common,Helmet,"Learn from the hooded bandits: trick the sand into letting you through, scam the heat into giving way.",Hood 01 Purple,-,-,,,42,0,0,0,0,0,13.00%,0.00%,0.00%,0.00%,15.00%,0.00%,5.00%,0.00%,0.00%,0.00%,0.00%,0.00%,1,Hard,0.00,0.00,2,2,0,1,5,Linear,1.37,1.1,Exponential
CA50,,Katana,1,Common,Weapon,A katana will only obey a man who can dance. May this katana be the arm you lack.,Sword 02 Normal,-,-,,,20,0,0,0,0,50,0.00%,0.00%,0.00%,0.00%,0.00%,0.00%,0.00%,0.00%,0.00%,0.00%,0.00%,2.00%,1,Hard,0.00,0.05,5,3,0,1,5,Linear,1.37,1.1,Exponential
CA51,,King Crown,1,Epic,Helmet,But the crown did not just give me power... it gave me the will to call this wretched world mine.,Crown 03,-,-,,,112,0,0,0,0,0,22.00%,0.00%,0.00%,10.00%,0.00%,0.00%,5.00%,0.00%,0.00%,0.00%,0.00%,0.00%,1,Hard,0.00,0.00,2,2,0,1,5,Exponential,1.18,1.1,Exponential
CA57,,Mage Hat,1,Epic,Helmet,"Yes, gladiator. This hat —magic itself, if you will— is but an illusion. But then again, what isn't?",Hat 01 Wizard Blue,,,,,165,0,0,0,0,0,20.00%,0.00%,0.00%,40.00%,0.00%,0.00%,0.00%,0.00%,0.00%,0.00%,0.00%,0.00%,1,Hard,0.00,0.03,2,2,0,1,5,Exponential,1.47,1.1,Exponential
CA58,,Magic Wand,1,Common,Weapon,Wands are not made. It's the wood that chooses to become one. It's the wood that allows itself to be used.,Wand 01 Stick Orange,-,-,,,0,60,0,0,0,0,0.00%,0.00%,0.00%,0.00%,0.00%,0.00%,0.00%,2.00%,0.00%,0.00%,0.00%,0.00%,1,Hard,0.00,0.00,0,1,0,1,5,Linear,1.67,1.1,Exponential
CA60,,Moring Star,1,Rare,Weapon,,Club 03 White,-,-,,,70,0,0,0,0,0,0.00%,0.00%,0.00%,0.00%,0.00%,0.00%,0.00%,0.00%,0.00%,0.00%,0.00%,0.00%,1,Hard,0.00,0.03,5,2,0,1,5,Exponential,1.73,1.1,Exponential
CA61,,Open Ring,1,Epic,Magic,"This ring will not reveal its powers instantly: it'll take time to master them, like catching a lighting bolt with your bare eye.",-,-,-,,,0,0,0,110,0,0,0.00%,0.00%,0.00%,15%,0.00%,0.00%,0.00%,0.00%,0.00%,0.00%,0.00%,0.00%,1,Hard,0.00,0.00,5,2,0,1,5,Exponential,1.69,1.1,Exponential
CA62,,Poison Dagger,1,Legendary,Weapon,"Poison is slow but incredibly deadly. This dagger wins battles like a man works the land: slowly, steadily, mercilessly.",Sword 06 Green,-,-,,,26,0,0,0,80,0,0.00%,0.00%,0.00%,0.00%,0.00%,0.00%,0.00%,0.00%,0.00%,0.00%,2.00%,0.00%,3,Hard,0.00,0.12,30,5,0,1,5,Exponential,1.35,1.05,Exponential
CA64,,Reaper Dagger,1,Legendary,Weapon,Deception is simply the tiny slit of a dagger into the fabric of truth.,Sword 09 Grey,-,-,,,99,0,0,0,0,0,0.00%,0.00%,0.00%,0.00%,0.00%,0.00%,0.00%,0.00%,0.00%,0.00%,0.00%,0.00%,2,Hard,0.00,0.15,35,5,0,1,5,Exponential,1.35,1.05,Exponential
CA66,,Reinforced Club,1,Rare,Weapon,,Club 02 Red,-,-,,,110,0,0,0,0,0,0.00%,0.00%,0.00%,0.00%,0.00%,0.00%,0.00%,0.00%,0.00%,0.00%,0.00%,0.00%,1,Hard,0.00,0.03,5,2,0,1,5,Linear,1.18,1.1,Exponential
CA69,,Royal Pendant,1,Legendary,Magic,"Will I, Queen of Rhythm, forfeit my royal pendant to any but the best?",-,-,-,,,18,18,18,18,18,18,0.00%,0.00%,0.00%,0.00%,0.00%,0.00%,0.00%,0.00%,0.00%,20.00%,0.00%,0.00%,1,Hard,0.00,0.00,5,2,0,1,5,Linear,1.85,1.1,Exponential
CA70,,Royal Spear,1,Legendary,Weapon,Bear this spear like a symbol to what royalty truly is: the power of all mankind rolled into one man.,Spear 03 White,-,-,,,85,0,0,95,0,0,0.00%,0.00%,0.00%,0.00%,0.00%,0.00%,0.00%,0.00%,0.00%,2.00%,0.00%,0.00%,1,Hard,0.00,0.00,5,3,0,1,5,Exponential,1.46,1.1,Exponential
CA94,,Ruin Shield,1,Rare,Shield,From our own ruins we shall rise again.,Shield 08 Black,-,-,,,70,25,0,0,0,0,0.00%,10.00%,0.00%,0.00%,0.00%,0.00%,0.00%,2.00%,0.00%,0.00%,0.00%,0.00%,1,Hard,0.90,0.00,5,2,0,1,5,Exponential,1.38,1.1,Exponential
CA73,,Saladin Ring,1,Epic,Magic,Legend has it this ring showed Saladin his way back when he lost himself.,-,-,-,,,149,0,0,0,0,0,0.00%,0.00%,0.00%,0.00%,0.00%,10.00%,0.00%,0.00%,0.00%,0.00%,0.00%,5.00%,1,Hard,0.00,0.00,5,5,0,1,5,Linear,1.07,1.1,Exponential
CA79,,Snake,1,Common,Pet,Sometimes temptation can be the road to self-knowledge.,-,-,-,,,18,0,0,0,35,0,0.00%,0.00%,0.00%,0.00%,0.00%,0.00%,0.00%,0.00%,0.00%,0.00%,5.00%,0.00%,1,Hard,0.00,0.00,4,2,0,1,5,Linear,1.52,1.1,Exponential
CA81,,Spear,1,Rare,Weapon,"And out of nowere, the spears started flying like bolts of lightning, like music...",Spear 01 Black,-,-,,,75,0,0,0,0,0,0.00%,0.00%,0.00%,0.00%,0.00%,0.00%,0.00%,0.00%,0.00%,0.00%,0.00%,0.00%,1,Hard,0.00,0.03,5,2,0,1,5,Exponential,1.68,1.1,Exponential
CA84,,Spike Armor,1,Rare,Armor,Wear the spike armor and you need only wait. All your opponent's attacks will simply bounce back.,-,Male Brown Knight 07 Purple,Female Brown Knight 07 Purple,,,200,0,0,0,0,0,23.00%,0.00%,0.00%,30.00%,0.00%,0.00%,0.00%,0.00%,0.00%,10.00%,0.00%,0.00%,1,Hard,0.00,0.00,2,2,0,1,5,Exponential,1.41,1.1,Exponential
CA92,,Wind Pendant,1,Rare,Magic,"Wear this pendant and learn not to control wind, but to sway to its mighty rhythm.",-,-,-,,,0,55,0,0,0,0,0.00%,0.00%,0.00%,0.00%,0.00%,0.00%,0.00%,10.00%,0.00%,0.00%,0.00%,0.00%,1,Hard,0.00,0.05,5,2,0,1,5,Exponential,1.78,1.1,Exponential
CA5,,Assasin Scimitar,1,Epic,Weapon,Feed this scimitar blood and its blade will keep sharp.,Sword 09 Red,-,-,,,45,0,124,0,0,35,0.00%,0.00%,0.00%,0.00%,0.00%,0.00%,0.00%,0.00%,2.00%,0.00%,0.00%,0.00%,1,Extra Hard,0.00,0.00,5,2,0,1,5,Exponential,1.405,1.1,Exponential
CA10,,Black Magic Ring,1,Epic,Magic,You do not take in darkness; darkness takes you in. Black magic is nothing but  untamed magic.,-,-,-,,,0,120,0,0,0,0,0.00%,15.00%,0.00%,0.00%,0.00%,0.00%,0.00%,5.00%,0.00%,0.00%,0.00%,0.00%,1,Extra Hard,0.00,0.00,0,2,0,1,5,Exponential,1.63,1.1,Exponential
CA15,,Butcher Knife,1,Unique,Weapon,,Sword 08 Red,-,-,,,180,0,0,0,0,50,0.00%,0.00%,0.00%,0.00%,0.00%,0.00%,0.00%,0.00%,0.00%,0.00%,0.00%,0.00%,1,Extra Hard,0.00,0.00,5,2,0,1,5,Exponential,1.6,1.1,Exponential
CA24,,Dead Dragon Ring,1,Legendary,Magic,"Killing a dragon is like defying nature. It's going against gravity, it's controlling fire.",-,-,-,,,70,0,0,0,0,55,0.00%,0.00%,0.00%,0.00%,10.00%,0.00%,0.00%,0.00%,0.00%,0.00%,0.00%,20.00%,1,Extra Hard,0.00,0.00,5,2,0,1,5,Exponential,1.68,1.1,Exponential
CA25,,Death Ring,1,Legendary,Magic,Only then I realized: death does not mean to stop living. Death means to stop fighting.,-,-,-,,,0,0,0,0,135,0,0.00%,0.00%,0.00%,0.00%,0.00%,0.00%,0.00%,0.00%,0.00%,0.00%,20.00%,0.00%,1,Extra Hard,0.00,0.00,5,2,0,1,5,Linear,1.47,1.1,Exponential
CA35,,Fireball Staff,1,Rare,Weapon,"You can cast the fireball, gladiator, but beware: great power usually entails great recoil.",Spear 03 Magenta,-,-,,,0,0,157,0,0,0,0.00%,0.00%,0.00%,0.00%,0.00%,0.00%,0.00%,0.00%,2.00%,0.00%,0.00%,0.00%,1,Extra Hard,0.00,0.02,1,5,0,1,5,Exponential,1.38,1.1,Exponential
CA38,,Frostbite Staff,1,Epic,Weapon,Cold can make your heart numb. And there's nothing more painful than dancing with a numb heart.,Spear 02 Blue,-,-,,,0,182,0,0,0,0,0.00%,0.00%,0.00%,0.00%,0.00%,0.00%,0.00%,2.00%,0.00%,0.00%,0.00%,0.00%,1,Extra Hard,0.00,0.02,1,5,0,1,5,Exponential,1.43,1.1,Exponential
CA44,,Great Axe,1,Epic,Weapon,,Axe 03 Red,-,-,,,125,0,0,0,0,40,0.00%,0.00%,0.00%,0.00%,0.00%,0.00%,5.00%,0.00%,2.00%,0.00%,0.00%,0.00%,1,Extra Hard,0.00,0.00,5,2,0,1,5,Linear,0.97,1.1,Exponential
CA45,,Guitar,1,Unique,Weapon,,Guitar 01 Brown,-,-,,,0,100,60,0,0,0,0.00%,0.00%,0.00%,0.00%,0.00%,0.00%,0.00%,0.00%,0.00%,0.00%,0.00%,0.00%,1,Extra Hard,0.00,0.00,5,2,0,1,5,Linear,1.8,1.1,Exponential
CA49,,Ice Sword,1,Unique,Weapon,,Sword 02 Ice,-,-,,,64,125,0,0,0,0,0.00%,0.00%,0.00%,0.00%,0.00%,0.00%,0.00%,5.00%,0.00%,0.00%,0.00%,0.00%,1,Extra Hard,0.00,0.00,5,2,0,1,5,Linear,1.8,1.1,Exponential
CA53,,Lighting Sword,1,Unique,Weapon,,Sword 05 Lightning,-,-,,,106,0,0,100,0,0,0.00%,0.00%,0.00%,0.00%,0.00%,0.00%,0.00%,0.00%,0.00%,2.00%,0.00%,0.00%,1,Extra Hard,0.00,0.00,5,2,0,1,5,Linear,1.7,1.1,Exponential
CA72,,Sadic Robes,1,Epic,Armor,"These robes have seen demons, sacrifice. They've seen blood curl out of a living body like a mighty snake.",-,Male Brown Wizard 04 Red,Female Browk Wizard 04 Red,,,15,0,0,0,0,120,0.00%,0.00%,0.00%,0.00%,0.00%,0.00%,0.00%,0.00%,0.00%,0.00%,0.00%,5.00%,1,Extra Hard,0.00,0.02,5,3,0,1,5,Exponential,1.55,1.1,Exponential
CA74,,Samurai Armor,1,Common,Armor,"Being a samurai means breathing in the silence, mastering the stillness of your mind...",-,Male Brown Knight 03 Purple,Female Brown Knight 03 Purple,,,0,0,120,0,0,0,14.00%,0.00%,0.00%,0.00%,0.00%,0.00%,0.00%,0.00%,5.00%,0.00%,0.00%,0.00%,1,Extra Hard,0.00,0.00,5,2,0,1,5,Exponential,1.6,1.1,Exponential
CA80,,Snake Ring,1,Epic,Magic,"Then I saw it: true desire sometimes comes from our darkest, and oftentimes it hides in our fears.",-,-,-,,,0,0,0,0,120,0,0.00%,0.00%,0.00%,0.00%,15.00%,0.00%,0.00%,0.00%,0.00%,0.00%,5.00%,0.00%,1,Extra Hard,0.00,0.00,5,2,0,1,5,Exponential,1.6,1.1,Exponential
CA90,,The Vindicator,1,Legendary,Weapon,The Vindicator was forged with such heavy magic that its weilding became impossible but for the strongest paladins.,Sword 09 Purple,-,-,,,140,140,0,0,0,0,0.00%,0.00%,0.00%,0.00%,0.00%,0.00%,0.00%,0.00%,0.00%,0.00%,0.00%,0.00%,1,Extra Hard,0.00,0.00,5,3,0,1,5,Exponential,1.33,1.1,Exponential
CA91,,Uka Mask,1,Epic,Pet,"And Uka lead me to the deaf vibrations of darkness and, for once, I allowed myself to follow.",-,-,-,,,0,171,0,0,0,0,0.00%,0.00%,0.00%,0.00%,0.00%,0.00%,0.00%,5.00%,0.00%,0.00%,0.00%,0.00%,1,Extra Hard,0.00,0.00,4,2,0,1,5,Exponential,1.45,1.1,Exponential
CA55,,Bat,1,Common,Pet,It's the tiniest creatures that know the biggest secrets of your way...,-,-,-,,,20,0,0,0,0,23,0.00%,0.00%,0.00%,0.00%,5.00%,0.00%,0.00%,0.00%,0.00%,0.00%,0.00%,0.00%,1,Easy,0.00,0.00,4,2,0,1,5,Linear,1.47,1.1,Exponential
CA6,,Bell,1,Seasonal,Weapon,,Bell 01 Gold,-,-,,,60,0,0,0,0,0,0.00%,0.00%,0.00%,0.00%,2.00%,0.00%,0.00%,0.00%,0.00%,0.00%,0.00%,0.00%,3,Easy,0.00,0.03,7,2,0,1,5,Linear,1.1,1.1,Exponential
CA18,,Claws,1,Common,Weapon,"Claw your way to enlightment, tear silence into music and music into silence.",Claw 01 Gold White,-,-,,,47,0,0,0,5,20,2.00%,0.00%,0.00%,0.00%,0.00%,0.00%,0.00%,0.00%,0.00%,0.00%,0.00%,2.00%,3,Easy,0.00,0.04,25,2,0,1,5,Linear,1.27,1.05,Exponential
CA20,,Club,1,Common,Weapon,,Club 01,-,-,,,58,0,0,0,0,0,0.00%,0.00%,0.00%,0.00%,0.00%,0.00%,2.00%,0.00%,0.00%,0.00%,0.00%,0.00%,1,Easy,0.00,0.00,3,2.5,0,1,5,Linear,1.27,1.1,Exponential
CA23,,Dagger,1,Common,Weapon,"The dagger, a simple weapon, will not show you its power, but present you with yours.",Dagger 01 Blue,-,-,,,47,0,0,0,0,0,0.00%,0.00%,0.00%,0.00%,2.00%,0.00%,0.00%,0.00%,0.00%,0.00%,0.00%,0.00%,3,Easy,0.00,0.10,5,2,0,1,5,Exponential,1.49,1.05,Exponential
CA65,,Giant Shield,1,Rare,Shield,"The giant shield will certainly protect you, gladiator, if only you bear to look small.",Shield 02 Brown,-,-,,,65,0,0,0,0,0,0.00%,0.00%,0.00%,0.00%,0.00%,10.00%,0.00%,0.00%,0.00%,0.00%,0.00%,0.00%,1,Easy,0.95,0.00,5,2,0,1,5,Linear,1.38,1.1,Exponential
CA30,,Reforged Shield,1,Common,Shield,Defense is merely the reforging of your opponent's offence...,Shield 06 Black,-,-,,,43,0,0,0,0,0,0.00%,0.00%,10.00%,0.00%,0.00%,0.00%,2.00%,0.00%,0.00%,0.00%,0.00%,0.00%,1,Easy,0.85,0.00,5,2,0,1,5,Linear,1.37,1.1,Exponential
CA68,,Royal Guard,1,Epic,Armor,The royal guard has served the colosseum for decades. No one will teach you to fight in it like them.,-,Male Brown Knight 06 Magenta,Female Brown Knight 06 Magenta,,,45,0,0,0,0,0,30.00%,0.00%,0.00%,0.00%,0.00%,0.00%,0.00%,0.00%,0.00%,0.00%,0.00%,0.00%,1,Easy,0.00,0.00,5,2,0,1,5,Linear,1.77,1.1,Exponential
